,author,category,description,publishedAt,source,title,url
91,Paul Joseph Watson,Featured Stories,"""They are safer now than when they were making that journey to the border"".","Fri, 22 Jun 2018 12:10:27 +0000",infowars,Fake News: Crying Child Used by Time Magazine & CNN Was Never Separated From Her Mother,https://www.infowars.com/fake-news-crying-child-used-by-time-magazine-cnn-was-never-separated-from-her-mother/
92,Breitbart,Featured Stories,"The mother and daughter were never separated, and were in fact in U.S. custody at a family residential facility in Texas.","Fri, 22 Jun 2018 12:09:10 +0000",infowars,Facebook Allows ‘Fake News’ Photo to Raise $18 Million for Border Cause,https://www.infowars.com/facebook-allows-fake-news-photo-to-raise-18-million-for-border-cause/
93,Chris Menahan  ,Featured Stories,No one was buying it.,"Fri, 22 Jun 2018 12:08:14 +0000",infowars,NYT Mocked After Video Of ‘Unaccompanied Migrant Children’ Appears to Show Grown Men,https://www.infowars.com/nyt-mocked-after-video-of-unaccompanied-migrant-children-appears-to-show-grown-men/
94,Fox News,Featured Stories,Dispute over redrawn borders could derail campaign,"Fri, 22 Jun 2018 11:41:16 +0000",infowars,Movement to Split California Into Three States Fractures After Making Ballot,https://www.infowars.com/movement-to-split-california-into-three-states-fractures-after-making-ballot/
95,The Hill,Featured Stories,Crazed Hollywood leftist vows to destroy President,"Fri, 22 Jun 2018 11:40:25 +0000",infowars,Tom Arnold Says He’s Teaming Up With Michael Cohen and ‘Taking Trump Down’,https://www.infowars.com/tom-arnold-says-hes-teaming-up-with-michael-cohen-and-taking-trump-down/
96,Reuters,Economy,Internal documents indicate trouble for electric car maker,"Fri, 22 Jun 2018 11:40:19 +0000",infowars,Tesla to Close a Dozen Solar Facilities In Nine States,https://www.infowars.com/tesla-to-close-a-dozen-solar-facilities-in-nine-states/
97,CNBC,Featured Stories,"After the cancellation of the hit sitcom ""Roseanne,"" Disney-owned ABC ordered 10 episodes of a spinoff with a working title ""The Conners"".","Fri, 22 Jun 2018 11:16:39 +0000",infowars,ABC orders 10 episodes of ‘Roseanne’ spinoff — without Roseanne Barr,https://www.infowars.com/abc-orders-10-episodes-of-roseanne-spinoff-without-roseanne-barr/
98,CNS News,Featured Stories,"Through a web survey of 1,440 U.S. adults, Gallup wanted to find out how much “problematic information” people find via T.V., newspapers, radio, and social media.","Fri, 22 Jun 2018 11:07:39 +0000",infowars,Gallup Poll: 62 Percent of Americans Believe Their News Is Biased,https://www.infowars.com/gallup-poll-62-percent-of-americans-believe-their-news-is-biased/
99,The Local,Featured Stories,A survey carried out by YouGov and published on Friday shows that 43 percent of Germans want Merkel to leave office.,"Fri, 22 Jun 2018 10:29:23 +0000",infowars,"Almost half of Germans want Merkel to resign, poll shows",https://www.infowars.com/almost-half-of-germans-want-merkel-to-resign-poll-shows/
